{
  "id": "unknown-actor-value",
  "name": "Unknown Actor Value",
  "category": "Reliability",
  "visitor": "tokens",
  "tags": [
    "correctness"
  ],
  "severity": "warning",
  "importance": "medium",
  "enabled_by_default": false,
  "fixable": false,
  "description": "Flags a call to an Actor Value function (GetActorValue, SetActorValue, ModActorValue, DamageActorValue, ...) whose Actor Value name isn't one of Skyrim's built-in ones, a strong sign of a typo. Only a plain string literal argument is checked. Disabled by default, since a project's own plugin can define custom Actor Values.",
  "definition": "Flags, as a `[warning]`, a call to an Actor Value function (`GetActorValue`, `SetActorValue`, `ModActorValue`, `DamageActorValue`, and the rest of that family) whose Actor Value name argument doesn't match one of Skyrim's built-in Actor Values, listed in `shared/rules/data/actor-values.yaml` \u2014 a strong signal of a typo. Matches by function name alone (case-insensitively), regardless of receiver, the same way \"Forbidden/discouraged function usage\" does; only a plain string literal argument is checked, one built from a variable or any other expression is left unflagged rather than guessed at. Disabled by default, since a project's own plugin can define additional, custom Actor Values that have no way to appear in `shared/rules/data/actor-values.yaml`; opt in with `rules.unknown_actor_value`."
}
