{
  "id": "return-types",
  "name": "Return type check",
  "category": "Reliability",
  "visitor": "ast",
  "tags": [
    "correctness"
  ],
  "severity": "error",
  "importance": "high",
  "fixable": false,
  "description": "Flags statements whose value's type doesn't match the enclosing function's declared return type.",
  "definition": "Flags `Return` statements whose value's type doesn't match the enclosing function's declared return type (e.g. returning a `String` from a Function declared `Int`), allowing the implicit `Int`-to-`Float` widening Papyrus itself allows, as well as returning an object whose script extends (directly or transitively) the declared return type (e.g. returning an `Armor` from a Function declared `Form`, or an `Actor` from a Function declared `ObjectReference`). When linting a `.psc` file dropped in the app, a returned value's own script's `Extends` chain is resolved from the project root to allow compatible subtypes there too, including engine types like `Actor`/`ObjectReference`/`Form` resolved from the configured script roots. A `Return` whose value's type can't be determined, or with no declared return type, is skipped rather than guessed at."
}
