{
  "id": "type-casing",
  "name": "Type name casing",
  "category": "Formatting",
  "visitor": "tokens",
  "tags": [
    "style"
  ],
  "severity": "warning",
  "importance": "low",
  "fixable": true,
  "description": "Flags a script's declared type name if it doesn't follow the configured convention. Ignores a leading acronym prefix (e.g. CreationKit's own fragment names or a mod's acronym prefix), which can't be renamed.",
  "definition": "Flags, as a `[warning]`, a script's declared type name (the identifier following `ScriptName`) if it doesn't follow the configured `type_casing` convention (`PascalCase`, `camelCase`, `lowercase`, or `UPPERCASE`). Only the script's own declared name is checked and fixed, never its `Extends` target, since that type is declared (and presumably already checked) in another script. Up to two leading acronym-prefix segments (one or more uppercase letters followed by one or more underscores, e.g. CreationKit's own `IDR__TIF__050000F5` dialogue fragment names or a modder's own `USSEP_` acronym prefix) are ignored, since that part of the name can't be renamed; only the rest of the name is checked and fixed. The fix only changes letter casing, preserving the name's characters so it remains compatible with its `.psc` filename; a violation that would require a substantive rename (such as removing an underscore for `PascalCase`) is left for the user to rename together with the file."
}
