{
  "id": "array-bounds",
  "name": "Array bounds",
  "category": "Bugprone",
  "visitor": "ast",
  "tags": [
    "correctness"
  ],
  "severity": "warning",
  "importance": "high",
  "fixable": false,
  "description": "Flags a literal index into a local array that falls outside the constant size it was declared with (e.g. new Float[3] followed by a[5]), since Papyrus silently no-ops the access instead of raising an error.",
  "definition": "Flags, as a `[warning]`, a literal index into a local array variable that falls outside the compile-time-constant size it was declared with (e.g. `Float[] a = new Float[3]` followed by `a[5] = 0.1`), since Papyrus doesn't raise a catchable error for an out-of-range array access \u2014 it just logs the mistake and silently no-ops the write or returns the type's default for a read. A variable starts tracking a size the moment it's assigned `new <Type>[<N>]` for a literal (or literal-arithmetic) `N`, and stops being tracked the moment it's assigned anything else; a size is only kept past an `If` when every surviving branch agrees on it, and a size learned only inside a `While` loop's body is never assumed to still hold afterward, since the loop may run zero times. Only a plain identifier's own index is checked; a member/property array, or an index built from anything other than a literal (optionally combined with arithmetic, comparison, logical, and unary operators), is left unflagged rather than guessed at. A `new <Type>[<N>]` whose own literal `N` falls outside the range Papyrus allows is flagged separately, by \"Array size range\" below."
}
